{
  "id": "seedance-oil-painting",
  "title": "油画中的水流运动",
  "summary_zh": "作者测试让油画画面动起来，说明初始图片由 Dreamina 3.1 生成。",
  "platform": "Blog",
  "source": {
    "url": "https://replicate.com/blog/seedance-2",
    "item_key": "oil-painting",
    "locator": "Dealing with physics 小节中油画与水流示例",
    "published_at": "2026-04-15",
    "access": "accessible"
  },
  "author": {
    "name": "shridharathi",
    "url": "https://replicate.com/shridharathi"
  },
  "collected_at": "2026-09-17",
  "models": [
    {
      "name": "Seedance",
      "version": "2.0",
      "role": "video_generation",
      "evidence_url": "https://replicate.com/blog/seedance-2"
    },
    {
      "name": "Dreamina",
      "version": "3.1",
      "role": "image_generation",
      "evidence_url": "https://replicate.com/blog/seedance-2"
    }
  ],
  "category": "图像动画与转场",
  "tags": [
    "图生视频",
    "参考图缺失",
    "简短指令"
  ],
  "prompt": {
    "status": "full",
    "original": "Animate this image",
    "language": "en",
    "translation_zh": "让这张图片动起来。",
    "recreated": null,
    "source_url": "https://replicate.com/blog/seedance-2",
    "scope": "该示例的视频生成指令",
    "locator": "Dealing with physics 小节中油画与水流示例",
    "notes": "作者披露的该条短指令完整收录；必须结合输入素材，不能只凭这一句话复现相同作品。"
  },
  "references": [
    {
      "kind": "image",
      "url": null,
      "status": "missing",
      "notes": "油画初始图片未取得可复现文件。"
    }
  ],
  "workflow_notes": [
    "作者说明先用 Dreamina 3.1 生成油画初始图。",
    "输入图片与视频 Prompt 共同决定结果。",
    "原始输入文件、种子和完整参数未收齐。"
  ],
  "video": {
    "page_url": "https://replicate.com/blog/seedance-2",
    "alternate_urls": [],
    "playback": "unchecked",
    "checked_at": null,
    "notes": "已读取作品所在页面及文字资料；未直接播放核对视频，不将页面可读等同于视频可播。",
    "display": {
      "embed_url": "https://github.com/user-attachments/assets/99f1d923-b995-4bc7-ac6a-5fcf491ea7cd",
      "poster_url": null,
      "evidence_url": "https://github.com/ZeroLu/awesome-seedance#74-image-to-video-physics-animation",
      "checked_at": "2026-09-17",
      "notes": "引用整理仓库中与原作对应的现有 GitHub 视频附件；匹配依据为同一原帖或作者博客示例。附件由外部仓库维护，未另行下载或转载。"
    }
  },
  "verification": {
    "level": "primary",
    "checked_at": "2026-09-17",
    "evidence_urls": [
      "https://replicate.com/blog/seedance-2"
    ],
    "ai_evidence": "作者在 Seedance 2.0 制作博客中把该视频示例与对应指令一同展示。",
    "notes": [
      "本次核对的是作者公开说明，未检查生成后台，也未实际生成复现。"
    ]
  },
  "review": {
    "status": "approved",
    "reviewed_at": "2026-09-17"
  },
  "rights": {
    "status": "link_only",
    "evidence_url": null,
    "notes": "保留原作者署名与原帖链接。页面引用外部托管的视频附件或原帖视频封面，未向本仓库上传第三方媒体。引用不表示已取得转载或商用许可，第三方内容不适用本仓库 MIT 许可。"
  },
  "reproduction": {
    "status": "not_attempted",
    "evidence_url": null,
    "notes": "未进行模型调用或复现；未披露的参数、种子和素材不补造。"
  }
}
