{
  "id": "ltx-cyberpunk-rooftop-zoom",
  "title": "LTX 2.5｜赛博朋克屋顶快速推镜",
  "summary_zh": "用城市环境声、快速人物推镜和一句对白，测试图生视频的镜头与口型表现。",
  "platform": "Reddit",
  "source": {
    "url": "https://www.reddit.com/r/StableDiffusion/comments/1vlxmrx/ltx_25_is_pretty_good/",
    "item_key": "main-video",
    "locator": "作者原帖：LTX 2.5 is pretty good",
    "published_at": "2026-08-11",
    "access": "accessible"
  },
  "author": {
    "name": "skyrimer3d",
    "url": "https://www.reddit.com/user/skyrimer3d/"
  },
  "collected_at": "2026-09-18",
  "models": [
    {
      "name": "LTX",
      "version": "2.5",
      "role": "video_generation",
      "evidence_url": "https://www.reddit.com/r/StableDiffusion/comments/1vlxmrx/ltx_25_is_pretty_good/"
    }
  ],
  "category": "动作与运镜",
  "tags": [
    "镜头与运镜"
  ],
  "prompt": {
    "status": "full",
    "original": "a realistic scene bustling cyberpunk city with buildings with lights flashing and city noise, a beautiful woman is standing in the roof top as the camera quickly zooms to her face and she says: \"LTX is back baby!\"",
    "language": "en",
    "translation_zh": null,
    "recreated": null,
    "source_url": "https://www.reddit.com/r/StableDiffusion/comments/1vlxmrx/ltx_25_is_pretty_good/",
    "scope": "作者公开的视频生成指令",
    "locator": "作者正文及可读的本人评论",
    "notes": "Prompt 在作者正文中的引号未完全配对，保留公开措辞；画质、声音和速度结论只作为作者经验。"
  },
  "references": [
    {
      "kind": "input_material",
      "url": null,
      "status": "missing",
      "notes": "图生视频输入图未归档。"
    }
  ],
  "workflow_notes": [],
  "video": {
    "page_url": "https://www.reddit.com/r/StableDiffusion/comments/1vlxmrx/ltx_25_is_pretty_good/",
    "alternate_urls": [],
    "playback": "unchecked",
    "checked_at": null,
    "notes": "已读取原帖和视频展示信息；本次未完整播放逐帧核对，不将封面可见等同于播放成功。",
    "display": {
      "embed_url": null,
      "poster_url": "https://external-preview.redd.it/ltx-2-5-is-pretty-good-v0-MGU4azl1cDJ5dGloMfG82Od9e2ZShZY8lZuIslk0t6DnDmjz_eBL5m3wqNKm.png?width=640&crop=smart&format=pjpg&auto=webp&s=38d2623aaa2c266ba32c920b8bffb37af690f2b6",
      "evidence_url": "https://www.reddit.com/r/StableDiffusion/comments/1vlxmrx/ltx_25_is_pretty_good/",
      "checked_at": "2026-09-18",
      "notes": "封面直接取自该原帖主视频播放器的 poster 属性；README 与详情页点击同一封面进入作者原帖。"
    }
  },
  "verification": {
    "level": "primary",
    "checked_at": "2026-09-18",
    "evidence_urls": [
      "https://www.reddit.com/r/StableDiffusion/comments/1vlxmrx/ltx_25_is_pretty_good/"
    ],
    "ai_evidence": "原帖标题、正文、作者评论或作品分类标注相关 AI 视频模型；本条公开原帖为核验依据。 Prompt 在作者正文中的引号未完全配对，保留公开措辞；画质、声音和速度结论只作为作者经验。",
    "notes": [
      "已核对原帖作者、作品标题、发布时间与主视频封面。模型版本按作者自述记录，未读取生成后台。",
      "正文和 Prompt 中提到的其他模型名称不自动计入本作品的生成模型。"
    ]
  },
  "review": {
    "status": "approved",
    "reviewed_at": "2026-09-18"
  },
  "rights": {
    "status": "link_only",
    "evidence_url": null,
    "notes": "保留原作者署名与原帖链接。页面引用外部托管的视频封面，未向本仓库上传第三方媒体。引用不表示已取得转载或商用许可，第三方内容不适用本仓库 MIT 许可。"
  },
  "reproduction": {
    "status": "not_attempted",
    "evidence_url": null,
    "notes": "未进行模型调用或复现；未披露的参数、种子和素材不补造。"
  }
}
