{
  "id": "ltx-high-resolution-i2v",
  "title": "LTX｜高分辨率图生视频测试",
  "summary_zh": "使用 Z-Image 首帧和 LTX-2 三阶段图生视频流程，展示高分辨率与帧率设置的实验。",
  "platform": "Reddit",
  "source": {
    "url": "https://www.reddit.com/r/StableDiffusion/comments/1q9cy02/ltx2_i2v_quality_is_much_better_at_higher/",
    "item_key": "main-video",
    "locator": "作者原帖：LTX-2 I2V: Quality is much better at higher resolutions (RTX6000 Pro)",
    "published_at": "2026-01-10",
    "access": "accessible"
  },
  "author": {
    "name": "000TSC000",
    "url": "https://www.reddit.com/user/000TSC000/"
  },
  "collected_at": "2026-09-18",
  "models": [
    {
      "name": "LTX",
      "version": "2",
      "role": "video_generation",
      "evidence_url": "https://www.reddit.com/r/StableDiffusion/comments/1q9cy02/ltx2_i2v_quality_is_much_better_at_higher/"
    },
    {
      "name": "Z-Image",
      "version": null,
      "role": "image_generation",
      "evidence_url": "https://www.reddit.com/r/StableDiffusion/comments/1q9cy02/ltx2_i2v_quality_is_much_better_at_higher/"
    }
  ],
  "category": "动作与运镜",
  "tags": [
    "镜头与运镜"
  ],
  "prompt": {
    "status": "not_found",
    "original": null,
    "language": null,
    "translation_zh": null,
    "recreated": null,
    "source_url": null,
    "scope": "本次可读原帖未取得对应视频的逐字生成 Prompt",
    "locator": "作者正文及可读的本人评论",
    "notes": "正文只有通用提示建议，没有该视频完整 Prompt；质量与硬件结论均为作者经验。"
  },
  "references": [
    {
      "kind": "input_material",
      "url": null,
      "status": "missing",
      "notes": "Z-Image 首帧未在仓库保存。"
    }
  ],
  "workflow_notes": [
    "作者报告 1728×1152、48 fps、三阶段流程及 Clownshark Res_2s sampler，后续另试 60 fps。"
  ],
  "video": {
    "page_url": "https://www.reddit.com/r/StableDiffusion/comments/1q9cy02/ltx2_i2v_quality_is_much_better_at_higher/",
    "alternate_urls": [],
    "playback": "unchecked",
    "checked_at": null,
    "notes": "已读取原帖和视频展示信息；本次未完整播放逐帧核对，不将封面可见等同于播放成功。",
    "display": {
      "embed_url": null,
      "poster_url": "https://external-preview.redd.it/ltx-2-i2v-quality-is-much-better-at-higher-resolutions-v0-dG8wbnljNGdpa2NnMaKVFjWR1odPE_QtYBpha_q0F7rKqcZXBCvDRlI7P2ZF.png?width=640&crop=smart&format=pjpg&auto=webp&s=7355ab61cf1d866167deb26ea295be78cae76a6e",
      "evidence_url": "https://www.reddit.com/r/StableDiffusion/comments/1q9cy02/ltx2_i2v_quality_is_much_better_at_higher/",
      "checked_at": "2026-09-18",
      "notes": "封面直接取自该原帖主视频播放器的 poster 属性；README 与详情页点击同一封面进入作者原帖。"
    }
  },
  "verification": {
    "level": "primary",
    "checked_at": "2026-09-18",
    "evidence_urls": [
      "https://www.reddit.com/r/StableDiffusion/comments/1q9cy02/ltx2_i2v_quality_is_much_better_at_higher/"
    ],
    "ai_evidence": "原帖标题、正文、作者评论或作品分类标注相关 AI 视频模型；本条公开原帖为核验依据。 正文只有通用提示建议，没有该视频完整 Prompt；质量与硬件结论均为作者经验。",
    "notes": [
      "已核对原帖作者、作品标题、发布时间与主视频封面。模型版本按作者自述记录，未读取生成后台。",
      "正文和 Prompt 中提到的其他模型名称不自动计入本作品的生成模型。"
    ]
  },
  "review": {
    "status": "approved",
    "reviewed_at": "2026-09-18"
  },
  "rights": {
    "status": "link_only",
    "evidence_url": null,
    "notes": "保留原作者署名与原帖链接。页面引用外部托管的视频封面，未向本仓库上传第三方媒体。引用不表示已取得转载或商用许可，第三方内容不适用本仓库 MIT 许可。"
  },
  "reproduction": {
    "status": "not_attempted",
    "evidence_url": null,
    "notes": "未进行模型调用或复现；未披露的参数、种子和素材不补造。"
  }
}
