{
  "id": "seedance-wasteland-meteor-film",
  "title": "Seedance｜废土与陨石短片",
  "summary_zh": "作者展示单条 Prompt 驱动的 34 秒短片，并说明平台还提供角色、关键帧与镜头控制。",
  "platform": "Reddit",
  "source": {
    "url": "https://www.reddit.com/r/aivideo/comments/1skeayk/wasteland_into_the_meteor_full_34_second_video/",
    "item_key": "main-video",
    "locator": "作者原帖：Wasteland: Into the Meteor - full 34 second video from one single prompt",
    "published_at": "2026-04-13",
    "access": "accessible"
  },
  "author": {
    "name": "Ok_Pop_9906",
    "url": "https://www.reddit.com/user/Ok_Pop_9906/"
  },
  "collected_at": "2026-09-18",
  "models": [
    {
      "name": "Seedance",
      "version": null,
      "role": "video_generation",
      "evidence_url": "https://www.reddit.com/r/aivideo/comments/1skeayk/wasteland_into_the_meteor_full_34_second_video/"
    }
  ],
  "category": "广告与短片",
  "tags": [
    "叙事短片"
  ],
  "prompt": {
    "status": "not_found",
    "original": null,
    "language": null,
    "translation_zh": null,
    "recreated": null,
    "source_url": null,
    "scope": "本次可读原帖未取得对应视频的逐字生成 Prompt",
    "locator": "作者正文及可读的本人评论",
    "notes": "模型按原帖分类记录，版本未披露；标题的 one prompt 不代表只有文本输入，作者未公开具体指令。"
  },
  "references": [],
  "workflow_notes": [],
  "video": {
    "page_url": "https://www.reddit.com/r/aivideo/comments/1skeayk/wasteland_into_the_meteor_full_34_second_video/",
    "alternate_urls": [],
    "playback": "unchecked",
    "checked_at": null,
    "notes": "已读取原帖和视频展示信息；本次未完整播放逐帧核对，不将封面可见等同于播放成功。",
    "display": {
      "embed_url": null,
      "poster_url": "https://external-preview.redd.it/wasteland-into-the-meteor-full-34-second-video-from-one-v0-YzltYTU5d200enVnMXvVJQaBx8gTSey8HIJtaSd8ArcfDWPnRnqGLP-JF7VK.png?width=640&crop=smart&format=pjpg&auto=webp&s=023e6683b2e1dbb37211a769b8a0439e39f70fbb",
      "evidence_url": "https://www.reddit.com/r/aivideo/comments/1skeayk/wasteland_into_the_meteor_full_34_second_video/",
      "checked_at": "2026-09-18",
      "notes": "封面直接取自该原帖主视频播放器的 poster 属性；README 与详情页点击同一封面进入作者原帖。"
    }
  },
  "verification": {
    "level": "primary",
    "checked_at": "2026-09-18",
    "evidence_urls": [
      "https://www.reddit.com/r/aivideo/comments/1skeayk/wasteland_into_the_meteor_full_34_second_video/"
    ],
    "ai_evidence": "原帖标题、正文、作者评论或作品分类标注相关 AI 视频模型；本条公开原帖为核验依据。 模型按原帖分类记录，版本未披露；标题的 one prompt 不代表只有文本输入，作者未公开具体指令。",
    "notes": [
      "已核对原帖作者、作品标题、发布时间与主视频封面。模型版本按作者自述记录，未读取生成后台。",
      "正文和 Prompt 中提到的其他模型名称不自动计入本作品的生成模型。"
    ]
  },
  "review": {
    "status": "approved",
    "reviewed_at": "2026-09-18"
  },
  "rights": {
    "status": "link_only",
    "evidence_url": null,
    "notes": "保留原作者署名与原帖链接。页面引用外部托管的视频封面，未向本仓库上传第三方媒体。引用不表示已取得转载或商用许可，第三方内容不适用本仓库 MIT 许可。"
  },
  "reproduction": {
    "status": "not_attempted",
    "evidence_url": null,
    "notes": "未进行模型调用或复现；未披露的参数、种子和素材不补造。"
  }
}
